{
  "schema_version": "1.0.0",
  "artifact_id": "ART-SYS-AST-0014-0001",
  "task_id": "SYS-AST-0014",
  "project_id": "casino-core",
  "artifact_type": "CODE",
  "name": "binary-asset-integrity-gate",
  "uri": "repo://studio_core/binary_assets.py",
  "version": "1.0.0",
  "content_hash": "sha256:60c61e3236bb04f08ea34169f0ea027f186033bb186f6a4a180a1471fe3efd2e",
  "status": "SUBMITTED",
  "source": {
    "kind": "AI_GENERATED",
    "created_by": "A-02",
    "provider": "claude_agent",
    "model": "claude-opus-5",
    "input_hash": "sha256:24c548d1b4a533b110687343c5f4dd51b23fc8035369be2f38f3f39b0687a001"
  },
  "rights": {
    "license": "TS-STUDIO-INTERNAL",
    "commercial_use": true,
    "training_permission": "NOT_APPLICABLE",
    "provenance_complete": true
  },
  "specification": {
    "policy_id": "BINARY-ASSETS-001",
    "policy_version": "BINARY-ASSETS-001/1.0.0",
    "policy_mode": "deny_by_default",
    "policy_file": "policies/binary-assets.yaml",
    "policy_file_hash": "sha256:3dd6c9b3372ef7ba31492670aecc51c4a2912b8b8d62f555c3d314fbee2adede",
    "manifest_schema": "contracts/asset-manifest.schema.json",
    "manifest_schema_hash": "sha256:465380a33c27f2fc08a99560959223d79ca8b2f626153243c72d33c56a6b9ada",
    "manifest_location_template": "assets/manifests/{task_id}-assets.json",
    "manifest_hash_algorithm_constant": "sha256-raw-bytes",
    "manifest_required_entry_fields": "path; content_hash; byte_size; media_type; source; rights",
    "allowed_roots": "assets",
    "allowed_extensions": ".png; .webp",
    "allowlist_expansion": "requires_approved_task (A-30 + USER)",
    "gate_module": "studio_core/binary_assets.py",
    "baseline_integration": "scripts/validate_baseline.py::validate_content_integrity, ::validate_binary_asset_policy",
    "baseline_integration_hash": "sha256:08756d3ac6fda7d70401957d19d33b8ba6456a49863e71f15be7179625f90138",
    "invariant_count": 7,
    "rejection_code_count": 28,
    "rejection_codes": "ASSET_NOT_ALLOWLISTED; EXTENSION_NOT_PINNED_BINARY; ASSET_SYMLINK; ASSET_PATH_ESCAPE; ASSET_PATH_ABSOLUTE; ASSET_PATH_BACKSLASH; ASSET_PATH_NOT_NORMALISED; ASSET_PATH_SCHEME; ASSET_PATH_EMPTY; ASSET_PATH_CONTROL_CHARACTER; ASSET_MISSING; ASSET_LFS_POINTER; ASSET_CREDENTIAL_LIKE; ASSET_UNTRACKED_BY_TASK; ASSET_HASH_CROSS_TASK; ASSET_HASH_UNDECLARED; ASSET_HASH_MALFORMED; ASSET_HASH_MISMATCH; ASSET_SIZE_MISMATCH; MANIFEST_SCHEMA_MISSING; MANIFEST_SCHEMA_INVALID; MANIFEST_FILENAME_MISMATCH; MANIFEST_TARGET_MISSING; MANIFEST_UNREADABLE; POLICY_MISSING; POLICY_INVALID; POLICY_NOT_DEFAULT_DENY; POLICY_NORMALISATION_ALLOWED",
    "binary_hash_representation": "raw_bytes",
    "binary_hash_function": "studio_core.binary_assets.raw_content_hash",
    "binary_text_normalization": "prohibited",
    "text_hash_function_unchanged": "studio_core.integrity.content_hash",
    "integrity_module_modified": false,
    "pre_read_rejection_enforced": true,
    "credential_scan_source": "studio_core.secret_scan.RULES",
    "credential_scan_allowlist_markers_applied": false,
    "git_lfs_in_use": false,
    "git_lfs_pointer_treatment": "substitution signal; denied",
    "task_traceability_required": true,
    "traceable_task_status": "READY; IN_PROGRESS; REVIEW; QA; DONE",
    "hash_declaration_sources": "artifact_primary; artifact_component; asset_manifest",
    "artifact_component_suffix": "_hash",
    "task_binding_scope": "same_task_only",
    "task_binding_rule": "an asset is traceable only when the declaring Task lists it as a deliverable AND the Artifact Contract or asset manifest that declares its hash carries the same task_id; hash declarations owned by any other task are ignored for traceability and are reported as ASSET_HASH_CROSS_TASK",
    "cross_task_artifact_declaration": "rejected (ASSET_HASH_CROSS_TASK)",
    "cross_task_manifest_declaration": "rejected (ASSET_HASH_CROSS_TASK)",
    "cross_task_rejection_code_note": "ASSET_HASH_CROSS_TASK is the code emitted by studio_core/binary_assets.py and asserted by tests/test_binary_assets.py whenever a foreign-task hash declaration exists for the asset; ASSET_UNTRACKED_BY_TASK remains the code for the case where no owning Task declares the asset as a deliverable at all",
    "cross_task_spoof_vector_closed": "a foreign task's Artifact primary/component hash or {other_task_id}-assets.json manifest can no longer satisfy the traceability invariant for this task's asset; such a declaration is rejected with ASSET_HASH_CROSS_TASK",
    "manifest_filename_task_id_binding_enforced": true,
    "gitattributes_cross_check": "policy-allowed extensions must be pinned binary or -text",
    "gitattributes_file_hash": "sha256:bb809b1676d2f217ea31ead2b7f3fd7bc9052b17144aba32c20dace88ef8cba8",
    "hardcoded_zero_binary_assertion_removed": true,
    "integrity_report_new_fields": "binary_assets.verified; binary_assets.count; existing files/verified/external checks preserved",
    "integrity_tests": "tests/test_integrity.py",
    "integrity_tests_hash": "sha256:aafe1e0bf75709b8698b6083ddfed2a5a15107d430dadd901241aa384fbb4243",
    "gate_tests": "tests/test_binary_assets.py",
    "gate_tests_hash": "sha256:6fb710d1ea9c357872c2c0264f8f12ea5eac1030f1946b6d7e55684deefc5fa2",
    "gate_tests_added_this_pass": "same-task binding acceptance; cross-task Artifact primary hash spoof rejection (ASSET_HASH_CROSS_TASK); cross-task Artifact component hash spoof rejection (ASSET_HASH_CROSS_TASK); cross-task asset manifest spoof rejection (ASSET_HASH_CROSS_TASK)",
    "gate_test_count": 109,
    "integrity_test_count": 27,
    "focused_test_count": 181,
    "focused_tests_command": "python -m unittest tests.test_binary_assets tests.test_integrity tests.test_baseline",
    "focused_tests_result": "PASS - re-run after the traceability fix: gate suite alone (python -m unittest tests.test_binary_assets) ran 109 tests, OK, skipped=4; combined focused suite (python -m unittest tests.test_binary_assets tests.test_integrity tests.test_baseline) ran 181 tests, OK, skipped=4",
    "focused_tests_last_run_error_cause": "RESOLVED - the earlier 4 errors were caused solely by the stale pre-fix studio_core/binary_assets.py hash declared in this Artifact Contract; after the hash correction the re-run reports 0 errors and 0 failures",
    "verification_status": "FOCUSED_PASS; FULL_SUITE_CANONICAL_LF_PASS; FULL_SUITE_WINDOWS_1_PRE_EXISTING_FAILURE; HOSTED_CI_PENDING",
    "full_suite_command": "python -m unittest discover -s tests -v",
    "full_suite_test_count": 579,
    "full_suite_result_windows_crlf_worktree": "FAILED (failures=1) - post-fix run on this Windows core.autocrlf=true worktree: Ran 579 tests, FAILED failures=1, skipped=4. The sole failure is tests/test_roulette_web_ui.py::StaticDeliveryTests::test_the_served_index_is_the_file_on_disk_and_links_only_local_assets, a pre-existing CRLF byte comparison in R4-UI-0006 that SYS-AST-0014 neither created nor modified; it is not a SYS-AST logic failure.",
    "full_suite_result_canonical_lf": "PASS - post-fix isolated canonical-LF replay of the current working tree: the tree was copied to a temporary directory, index.html was normalised from CRLF to LF in that copy, and `python -m unittest discover -s tests -v` reported Ran 579 tests, OK, skipped=6, exit code 0; the temporary copy was then deleted. This confirms the sole Windows worktree failure is a CRLF checkout artefact, not a logic failure.",
    "full_suite_result_canonical_lf_counts": "Ran 579; OK; skipped=6; exit 0",
    "full_suite_pass_claimed": true,
    "hosted_ci_result": "PENDING - the GitHub-hosted Actions run has not been executed or observed on this pass.",
    "negative_fixtures_created_at_runtime": true,
    "negative_fixtures_location": "tempfile.TemporaryDirectory()",
    "binary_assets_added_by_this_task": 0,
    "repository_binary_count_before": 0,
    "repository_binary_count_after": 0,
    "zero_binaries_is_a_passing_state": true,
    "operations_guide": "docs/operations/SYS-AST-0014-binary-asset-integrity-gate.md",
    "operations_guide_hash": "sha256:569b940e6b794d4a4d8af8111bacec426d84f8ee222eedf36f7920d887816c63",
    "audit_events": "audit/events/SYS-AST-0014-events.json",
    "audit_events_hash": "sha256:097485de50bec571bfd8268923f69f34910a1d69f8f489a917a7bed920fbb25c",
    "audit_event_count": 8,
    "audit_chain_verified": true,
    "audit_contains_secret": false,
    "provider_registry_modified": false,
    "provider_routes_modified": false,
    "roulette_rules_rng_settlement_modified": false,
    "roulette_web_app_modified": false,
    "human_approval_recorded": false,
    "committed": false,
    "pushed": false,
    "hosted_ci_run_observed": false
  },
  "reviewers": ["A-20", "A-50"],
  "created_at": "2026-09-02T00:00:00Z",
  "approved_at": null
}
