{
  "schema_version": "1.0.0",
  "artifact_id": "ART-SYS-QA-0015-0001",
  "task_id": "SYS-QA-0015",
  "project_id": "casino-core",
  "artifact_type": "CODE",
  "name": "static-delivery-crlf-safe-test",
  "uri": "repo://tests/test_roulette_web_ui.py",
  "version": "1.1.0",
  "content_hash": "sha256:369b665a70aadafded4041fd110dc2af9d298e507c58adbff42d182d66fcb3a9",
  "status": "SUBMITTED",
  "source": {
    "kind": "AI_GENERATED",
    "created_by": "A-20",
    "provider": "claude_agent",
    "model": "claude-opus-5",
    "input_hash": "sha256:bb17b2c736033f75fd9cda0480079ea7eef95549106794b1651265b5933f8df9"
  },
  "rights": {
    "license": "TS-STUDIO-INTERNAL",
    "commercial_use": true,
    "training_permission": "NOT_APPLICABLE",
    "provenance_complete": true
  },
  "specification": {
    "defect": "StaticDeliveryTests.test_the_served_index_is_the_file_on_disk_and_links_only_local_assets compared the HTTP response body decoded to str against pathlib.Path.read_text(), which opens in universal-newlines mode and folds CRLF to LF; the static handler answers with candidate.read_bytes(), so on a Windows core.autocrlf=true checkout of the LF-committed index.html the two sides differed on line terminators alone and a correct delivery was reported as a failure.",
    "defect_origin_task": "R4-UI-0006",
    "defect_introduced_by_this_task": false,
    "fix": "the assertion now compares raw bytes on both sides: self.assertEqual(body, INDEX.read_bytes()); the decoded text is retained only for the two local-asset link assertions",
    "fix_line_count_changed": 12,
    "fix_assertion_before": "self.assertEqual(text, read(INDEX))",
    "fix_assertion_after": "self.assertEqual(body, INDEX.read_bytes())",
    "read_text_in_assertion_path": false,
    "read_helper_retained_for_other_tests": true,
    "local_asset_assertions_retained": "href=\"/styles.css\"; src=\"/app.js\"",
    "weakening_constructs_used": "none: no substring comparison, no length comparison, no newline normalisation on either side, no whitespace stripping, no assertIn substitution, no skip, no expectedFailure",
    "skip_or_expectedfailure_added": false,
    "negative_test_added_to_repository": false,
    "negative_verification_method": "out-of-band replay in a temporary copy of the working tree; no tracked file was modified",
    "changed_files": "tasks/SYS-QA-0015.json; tests/test_roulette_web_ui.py; artifacts/R4-UI-0006-artifact.json; artifacts/SYS-QA-0015-artifact.json; handoffs/SYS-QA-0015-handoff.json",
    "changed_files_count": 5,
    "test_file_hash_before": "sha256:bb17b2c736033f75fd9cda0480079ea7eef95549106794b1651265b5933f8df9",
    "test_file_hash_after": "sha256:369b665a70aadafded4041fd110dc2af9d298e507c58adbff42d182d66fcb3a9",
    "task_contract_input_repinned": "tasks/SYS-QA-0015.json inputs[repo://tests/test_roulette_web_ui.py].content_hash was re-pinned from the pre-change hash to the post-change hash so validate_content_integrity's declared-hash drift check passes, and inputs[repo://artifacts/R4-UI-0006-artifact.json].content_hash records the post-repin hash of that file",
    "r4_ui_0006_artifact_component_hash_repinned": true,
    "r4_ui_0006_artifact_component_hash_before": "sha256:bb17b2c736033f75fd9cda0480079ea7eef95549106794b1651265b5933f8df9",
    "r4_ui_0006_artifact_component_hash_after": "sha256:369b665a70aadafded4041fd110dc2af9d298e507c58adbff42d182d66fcb3a9",
    "r4_ui_0006_artifact_repin_reason": "validate_r4_playable_slice in scripts/validate_baseline.py enforces that every component hash R4-UI-0006 declares equals the canonical hash of the file on disk, so correcting tests/test_roulette_web_ui.py necessarily invalidates that declaration; this is linked-integrity metadata following its subject, not a way around the check",
    "r4_ui_0006_artifact_keys_changed": 1,
    "r4_ui_0006_artifact_diff_lines": "1 insertion, 1 deletion",
    "r4_ui_0006_artifact_status_changed": false,
    "r4_ui_0006_artifact_reviewers_changed": false,
    "r4_ui_0006_artifact_approval_claims_changed": false,
    "r4_ui_0006_artifact_history_claims_changed": false,
    "r4_ui_0006_artifact_hash_before_repin": "sha256:1bbcce3ef79d27e775bf14424852b4ead797810b0a3ba8b96d8ae3a6192bc8d4",
    "r4_ui_0006_artifact_hash_after_repin": "sha256:95dfa3f3566f130f880521941a05f01879c5e7e7ec1aa77b37278cf29289b953",
    "scope_amended_by_rework": "tasks/SYS-QA-0015.json was amended under USER authorisation before the metadata edit: artifacts/R4-UI-0006-artifact.json was added as both an input and a deliverable, AC-009 was widened from four paths to five, AC-015 seals the edit to that single component hash, AC-016 forbids weakening or bypassing the validator, rollback now restores both tracked files together, budget was raised to a finite 12.0 USD with stop_on_limit true, and updated_at moved to 2026-09-02T04:00:00Z; status stayed READY and owner stayed A-20",
    "validator_or_studio_core_modified": false,
    "index_html_worktree_form": "CRLF (347 CRLF pairs, 0 bare LF, 17493 bytes) on this physical Windows core.autocrlf=true checkout",
    "index_html_canonical_form": "LF (17146 bytes)",
    "index_html_modified": false,
    "server_py_modified": false,
    "table_py_modified": false,
    "static_assets_modified": false,
    "static_handler_still_read_bytes": true,
    "art_or_binary_assets_touched": 0,
    "repository_binary_count_before": 2,
    "repository_binary_count_after": 2,
    "new_runtime_dependency": false,
    "focused_test_command": "python -m unittest tests.test_roulette_web_ui -v",
    "focused_test_count": 38,
    "focused_test_result": "PASS - Ran 38 tests, OK, on this Windows CRLF worktree; the target test passed where it previously failed",
    "focused_target_result_before_fix": "FAIL - AssertionError comparing a CRLF response body against an LF-normalised read_text() load",
    "focused_target_result_after_fix": "PASS",
    "r4_suite_command": "python -m unittest tests.test_roulette_web_server tests.test_roulette_web_ui",
    "r4_suite_result": "PASS - Ran 92 tests, OK",
    "crlf_lf_parity_method": "the working tree was copied to a temporary directory (.git, __pycache__, runtime and *.sqlite3 excluded) and the target test was run there with index.html materialised first as LF and then as CRLF",
    "crlf_lf_parity_result": "PASS in both forms - LF variant exit 0 (Ran 1, OK), CRLF variant exit 0 (Ran 1, OK); identical verdict from both line-ending forms",
    "negative_tamper_method": "in the same temporary copy the static handler was patched to answer with candidate.read_bytes().replace(b'<title>', b'<Title>', 1), a single-byte change (0x74 to 0x54) between the delivered body and the file on disk",
    "negative_tamper_result": "FAIL as required - exit 1, Ran 1, FAILED (failures=1) in both the LF and the CRLF form; reverting the patch in the copy returned the test to exit 0",
    "negative_tamper_bytes_changed": 1,
    "compile_check_command": "python -m compileall -q tests/test_roulette_web_ui.py",
    "compile_check_result": "PASS",
    "secret_scan_command": "python scripts/scan_secrets.py",
    "secret_scan_result": "PASS - no finding",
    "baseline_command": "python scripts/validate_baseline.py",
    "baseline_result": "PASS - exit 0, every published check reported [PASS], including the R4-UI-0006 playable-slice unit whose component-hash binding this task re-pinned",
    "baseline_result_before_repin": "FAIL - [FAIL] R0 baseline: artifact component hash does not match tests/test_roulette_web_ui.py: sha256:369b665a70aadafded4041fd110dc2af9d298e507c58adbff42d182d66fcb3a9 != sha256:bb17b2c736033f75fd9cda0480079ea7eef95549106794b1651265b5933f8df9",
    "full_suite_command": "python -m unittest discover -s tests -v",
    "full_suite_test_count": 579,
    "full_suite_result_windows_crlf_worktree": "PASS - Ran 579 tests, OK, skipped=4 on this physical Windows core.autocrlf=true checkout; the single pre-existing failure recorded by SYS-IMG-0013, SYS-AST-0014 and R4-ART-0007 is gone",
    "pre_existing_windows_failure_cleared": true,
    "verification_status": "FOCUSED_PASS; BASELINE_PASS; FULL_SUITE_PASS_ON_WINDOWS_CRLF_WORKTREE; INDEPENDENT_VERIFICATION_PENDING; HOSTED_CI_NOT_RUN",
    "independent_verification_claimed": false,
    "final_approval_claimed": false,
    "hosted_ci_result": "NOT_RUN",
    "human_approval_recorded": false,
    "committed": false,
    "pushed": false,
    "branch": "fix/windows-crlf-static-test"
  },
  "reviewers": ["A-50", "A-02"],
  "created_at": "2026-09-02T00:00:00Z",
  "approved_at": null
}
