{
  "schema_version": "1.0.0",
  "artifact_id": "ART-SYS-CI-0012-0001",
  "task_id": "SYS-CI-0012",
  "project_id": "casino-core",
  "artifact_type": "BUILD",
  "name": "github-actions-ci-workflow",
  "uri": "repo://.github/workflows/ci.yml",
  "version": "1.0.0",
  "content_hash": "sha256:69a77867bf26634a20ac73d6f1b782816d9ac4b4a90f1884e7f6b13065c26b4d",
  "status": "SUBMITTED",
  "source": {
    "kind": "AI_GENERATED",
    "created_by": "A-02",
    "provider": "claude_agent",
    "model": "claude-opus-5",
    "input_hash": "sha256:893fe4310d82a5166332ff2589e0246ba7bed0360c485a45bf569452a134fe4c"
  },
  "rights": {
    "license": "TS-STUDIO-INTERNAL",
    "commercial_use": true,
    "training_permission": "NOT_APPLICABLE",
    "provenance_complete": true
  },
  "specification": {
    "workflow_name": "CI",
    "format": "yaml",
    "triggers": "pull_request; push to main",
    "jobs": "baseline (python 3.11, 3.12); secret-scan (python 3.12)",
    "checks": "validate_baseline.py; unittest discover -s tests -v; compileall studio_core scripts tests; scan_secrets.py",
    "workflow_permissions": "contents: read",
    "job_permissions": "contents: read",
    "concurrency_cancel_in_progress": true,
    "baseline_timeout_minutes": 15,
    "secret_scan_timeout_minutes": 10,
    "persist_credentials": false,
    "uses_secrets_context": false,
    "actions_used": "actions/checkout@11d5960a326750d5838078e36cf38b85af677262 (v4); actions/setup-python@a26af69be951a213d495a4c3e4e4022e16d87065 (v5)",
    "actions_pinned_to_commit_sha": true,
    "action_pin_registry": "tests/test_secret_scan.py::APPROVED_ACTION_PINS",
    "action_pin_enforcement": "tests assert every `uses:` matches `owner/repo@<40-hex sha> # <tag>` and equals the approved SHA and tag; a bump requires editing the workflow line and the registry together",
    "content_hash_algorithm": "sha256 over LF-normalized bytes (CRLF collapsed before hashing; content holding a NUL byte hashed verbatim) via scripts/validate_baseline.py::content_sha256, so a Windows autocrlf checkout and a Linux runner derive the same hash for one commit",
    "installed_dependencies": "PyYAML>=6,<7",
    "scanner_engine": "studio_core/secret_scan.py",
    "scanner_engine_hash": "sha256:e420a90ef3bbd19bb60f5e3ec9edde95f7d24878cfcc201dcc972f1919be48e8",
    "scanner_cli": "scripts/scan_secrets.py",
    "scanner_cli_hash": "sha256:b386cb8b15991def870d6c535cac1a00fec875f9e1634ea78afa4a4a8421ef9f",
    "scanner_rule_count": 11,
    "scanner_deterministic": true,
    "scanner_redacts_matches": true,
    "scanner_failure_exit_code": 1,
    "tests": "tests/test_secret_scan.py",
    "test_count": 43,
    "allowlist_fixture": "tests/fixtures/secret_scan/allowlisted-sample.txt",
    "operations_guide": "docs/operations/SYS-CI-0012-ci-validation.md",
    "depends_on_pr_2": false,
    "modifies_r2_scope": false,
    "hosted_actions_run_observed": false,
    "committed": false
  },
  "reviewers": ["A-20", "A-50"],
  "created_at": "2026-09-01T00:00:00Z",
  "approved_at": null
}
