{
  "schema_version": "1.0.0",
  "artifact_id": "ART-R4-UI-0006-0001",
  "task_id": "R4-UI-0006",
  "project_id": "casino-core",
  "artifact_type": "BUILD",
  "name": "r4-roulette-playable-slice",
  "uri": "repo://apps/roulette_web/server.py",
  "version": "0.1.0",
  "content_hash": "sha256:2574ff8d355cc5df0708e57ca0846b4f7c03f531046b957d2926fd6dcd67dda8",
  "status": "SUBMITTED",
  "source": {
    "kind": "AI_GENERATED",
    "created_by": "A-02",
    "provider": "claude_agent",
    "model": "claude-opus-5",
    "input_hash": "sha256:03031cf600fe847737d535c364f183b6f0031464fc3a8fdd076b79826506733a"
  },
  "rights": {
    "license": "TS-STUDIO-INTERNAL",
    "commercial_use": true,
    "training_permission": "NOT_APPLICABLE",
    "provenance_complete": true
  },
  "specification": {
    "artifact_role": "R4-UI-0006 Phase B 실행 가능한 룰렛 슬라이스 빌드 아티팩트",
    "artifact_scope": "이 산출물이 등록하는 대상은 로컬 루프백 전용 프로토타입 슬라이스다. 프라이머리 파일은 apps/roulette_web/server.py이며 나머지 구성요소는 component_hash 항목으로 개별 선언한다.",
    "represents": "apps/roulette_web/server.py",
    "represents_implementation": true,
    "phase": "PHASE_B_IMPLEMENTATION",
    "task_status_at_registration": "IN_PROGRESS",
    "risk_class": "HIGH",
    "risk_reason": "슬라이스가 규칙·RNG·원장 결과를 화면에 제시하고 권위 서버 호출 경로를 만들기 때문에 policies/risk.yaml 기준 High로 분류한다.",
    "component_hash:apps/roulette_web/table.py": "sha256:22397b7dd4406647f4038b43b7b977405c56f1d04fae913e23c2dee578af41ae",
    "component_hash:apps/roulette_web/server.py": "sha256:2574ff8d355cc5df0708e57ca0846b4f7c03f531046b957d2926fd6dcd67dda8",
    "component_hash:apps/roulette_web/static/index.html": "sha256:149d6d6fb17f2d17f5db073a95f9eee284385cdb306d14505d9fb6d1a5636276",
    "component_hash:apps/roulette_web/static/styles.css": "sha256:9b9b9fa049e99b66bb613cfb8e3671c78f5c1846c17db5e797525b47ad6a32ed",
    "component_hash:apps/roulette_web/static/app.js": "sha256:f35b8cb5b33a5a4d2f34db9923dda9a916243c7f91b4875aa588dc6e40e70608",
    "component_hash:tests/test_roulette_web_server.py": "sha256:4f8941b211fc987a65ed0b13b7971ca9619738d53ed821f9dc5fe2962e8bf77d",
    "component_hash:tests/test_roulette_web_ui.py": "sha256:bb17b2c736033f75fd9cda0480079ea7eef95549106794b1651265b5933f8df9",
    "component_hash:games/roulette/playable-slice-contract.yaml": "sha256:be2d91b4c30f5432a949dea91afa06c3ae73def94c443659b8085a3e13a44eff",
    "implementation_completed": true,
    "focused_tests_passed": true,
    "human_approved": false,
    "browser_visual_qa_observed": false,
    "hosted_ci_observed": false,
    "independent_review_completed": false,
    "committed": false,
    "pushed": false,
    "rng_module_modified": false,
    "roulette_rules_module_modified": false,
    "durable_state_module_modified": false,
    "ledger_module_modified": false,
    "network_reconnect_guarantee_implemented": false,
    "load_or_performance_characterised": false,
    "penetration_tested": false,
    "production_ready": false,
    "runtime": "python3.11+ stdlib http.server",
    "client": "vanilla HTML/CSS/JS, no build step",
    "node_available": false,
    "npm_dependencies": "none",
    "external_cdn_assets": "none",
    "server_authoritative": true,
    "client_computes_authoritative_result": false,
    "client_computes_payout": false,
    "currency_units": "integer_minimum_units_only",
    "duplicate_request_behavior": "RETURN_ORIGINAL_RESULT",
    "network_binding": "loopback_only",
    "cashout_or_redemption": "out_of_scope",
    "real_world_prizes": "out_of_scope",
    "payment_or_monetization": "out_of_scope",
    "login_or_pii_collection": "out_of_scope",
    "production_deployment": "out_of_scope",
    "release_schedule": "prohibited_before_r5",
    "internal_prototype_label_required": true,
    "virtual_chips_label_required": true,
    "no_cash_value_label_required": true,
    "accessibility_requirements": "keyboard operable, visible focus, prefers-reduced-motion respected, screen-reader status announcements, mobile-responsive portrait layout",
    "depends_on": "R2-RNG-0001, R2-DBC-0002",
    "reuses_interfaces": "studio_core.rng.RouletteDrawEngine, studio_core.roulette.validate_bet/settle_bet, studio_core.durable_state.DurableRoundStore, studio_core.ledger.post_transaction",
    "protocol_contract": "games/roulette/playable-slice-contract.yaml",
    "design_document": "docs/games/R4-roulette-playable-slice.md",
    "validation_report": "docs/approvals/R4-UI-0006-validation-report.md",
    "validation_command_baseline": "python scripts/validate_baseline.py",
    "validation_command_tests": "python -m unittest discover -s tests -v",
    "secrets_recorded": false,
    "content_hash_form": "canonical LF (studio_core.integrity.hash_file)",
    "lifecycle_note": "SUBMITTED: 구현과 집중 시험은 완료되었으나 독립 검토, 브라우저 시각 QA, 호스트 CI, 인간 게이트가 모두 미완이므로 REVIEWED 이상으로 승격할 수 없다.",
    "successor_status_requires": "A-30 독립 읽기 전용 코드 검토, 브라우저 시각 QA 관측, 호스트 CI 통과, A-50·USER 최종 게이트 판정"
  },
  "reviewers": ["A-30", "A-50"],
  "created_at": "2026-09-02T00:00:00Z",
  "approved_at": null
}
