{
  "schema_version": "1.0.0",
  "artifact_id": "ART-R4-FIX-0008",
  "task_id": "R4-FIX-0008",
  "project_id": "casino-core",
  "artifact_type": "CODE",
  "name": "r4-settlement-failure-recovery",
  "uri": "repo://apps/roulette_web/table.py",
  "version": "1.2.0",
  "content_hash": "sha256:4721edb1d14d64829f750f6e403e5b72dc992be58fe4db22454f238939e1dd16",
  "status": "SUBMITTED",
  "source": {
    "kind": "AI_GENERATED",
    "created_by": "A-02",
    "provider": "claude_agent",
    "model": "claude-fable-5-1",
    "input_hash": "sha256:f38928a7af50a3e554297519ddcea42d08095fb0b2e9f132efb37b63c5e6a7d9"
  },
  "rights": {
    "license": "TS-STUDIO-INTERNAL",
    "commercial_use": true,
    "training_permission": "NOT_APPLICABLE",
    "provenance_complete": true
  },
  "specification": {
    "artifact_role": "R4-FIX-0008 settlement failure recovery implementation artifact",
    "artifact_scope": "Registers the repaired apps/roulette_web/table.py and pins the regression suite and self-check report by hash. Version 1.0.0 of this artifact was the issued task packet (uri repo://tasks/R4-FIX-0008.json, created by A-50); 1.1.0 was the INITIAL implementation (pre-commit cleanup only), rejected by an independent Codex probe and a separate read-only Fable code-reviewer because an after_commit fault reported the committed round VOIDED with no result and refused a same-id retry; 1.2.0 is the REWORK implementing the issuer-added AC-006 (post-commit reconciliation against the matching durable request and round via public draw_record and submit_round replay, original exception preserved, fail-closed on reconciliation failure). No store, RNG, server, client, CSS, HTML or asset file changed.",
    "represents": "apps/roulette_web/table.py",
    "represents_implementation": true,
    "phase": "PHASE_B_REWORK_SUBMITTED",
    "task_status_at_submission": "READY",
    "risk_class": "HIGH",
    "base_commit": "dd480594a433a662033e5e8fde560141a999a008",
    "task_contract_hash": "sha256:f38928a7af50a3e554297519ddcea42d08095fb0b2e9f132efb37b63c5e6a7d9",
    "task_contract_hash_note": "tasks/R4-FIX-0008.json was amended by the issuer (AC-006) during the 1.1.0 run; 1.1.0 pinned sha256:af0bd4cb...; A-02 did not edit the task file.",
    "component_hash:apps/roulette_web/table.py": "sha256:4721edb1d14d64829f750f6e403e5b72dc992be58fe4db22454f238939e1dd16",
    "component_hash:tests/test_settlement_failure_recovery.py": "sha256:3fa1ae41df07105d6cac63ff31a7f4b27f0e43f02b38df6f582ddfc57a1d7840",
    "component_hash:docs/approvals/R4-FIX-0008-validation-report.md": "sha256:51d1cb578fb5e50e41a58ee044a51a4f3796acd52a6e50d54d6c89a98d926f41",
    "content_hash_form": "canonical LF (studio_core.integrity.hash_file)",
    "previous_table_hash": "sha256:6dfe077268ad52b4f6014dcb58ce892b591b42c0d6aeee9f654bb0ef48cd525a",
    "base_table_hash": "sha256:22397b7dd4406647f4038b43b7b977405c56f1d04fae913e23c2dee578af41ae",
    "transitive_hash_repin_files": 10,
    "transitive_hash_repin_values": 21,
    "r4_art_metadata_changed": false,
    "new_error_codes_added": false,
    "public_api_changed": false,
    "store_rng_api_changed": false,
    "implementation_started": true,
    "implementation_completed": true,
    "regression_tests_failed_before_fix": true,
    "regression_tests_pre_fix_result": "INITIAL suite vs base dd48059: 8 tests, failures=14; REWORK PostCommitFaultTests vs INITIAL (1.1.0) semantics: 5 tests, failures=5, errors=1",
    "regression_tests_post_fix_result": "12 tests, OK (8 INITIAL tests retained minus the superseded after_commit test, plus 5 strengthened AC-006 tests)",
    "tests_run": true,
    "validation_commands_executed": true,
    "preliminary_claude_reviewer_rejected_revision": "1.1.0 (after_commit local VOIDED); correction in 1.2.0 awaits final review",
    "claude_internal_code_review_completed": false,
    "independent_verification_completed": false,
    "browser_qa_completed": false,
    "human_approved": false,
    "final_qa_approved": false
  },
  "reviewers": [
    "A-50"
  ],
  "created_at": "2026-09-03T00:00:00Z"
}
