{
  "schema_version": "1.0.0",
  "artifact_id": "ART-R2-LOAD-0004-0001",
  "task_id": "R2-LOAD-0004",
  "project_id": "casino-core",
  "artifact_type": "SCHEMA",
  "name": "r2-load-observation-contract",
  "uri": "repo://games/roulette/load-observation-contract.yaml",
  "version": "1.0.0",
  "content_hash": "sha256:4e9a4f515c46eab28245a4d205a890f8a35847fb4ec3e6d5436953be3e425fc2",
  "status": "SUBMITTED",
  "source": {
    "kind": "AI_GENERATED",
    "created_by": "A-02",
    "provider": "claude_agent",
    "model": "claude-opus-5[1m]",
    "input_hash": "sha256:6914fd6ef5fdc4cfd9dd35c8c7a4bb4a85c3027f0ff9a46026a9117e84fe54a2"
  },
  "rights": {
    "license": "TS-STUDIO-INTERNAL",
    "commercial_use": true,
    "training_permission": "NOT_APPLICABLE",
    "provenance_complete": true
  },
  "specification": {
    "artifact_role": "R2-LOAD-0004 유계 로컬 동시 부하 관측 유닛의 구현 제출 아티팩트다. 대표 바인딩 대상은 발행 계약 games/roulette/load-observation-contract.yaml이며, 나머지 구현 산출물 5종은 아래 component_hash 항목에 정규 LF 해시로 함께 고정된다.",
    "represents": "games/roulette/load-observation-contract.yaml",
    "represents_implementation": true,
    "phase": "PHASE_C_IMPLEMENTATION_SUBMITTED",
    "task_status_at_submission": "READY",
    "risk_class": "MEDIUM",
    "owner_agent_id": "A-02",
    "approvers_declared": "USER, A-50, A-02",
    "user_is_approver": true,
    "content_hash_form": "canonical LF (studio_core.integrity.hash_file)",
    "task_contract_hash": "sha256:6914fd6ef5fdc4cfd9dd35c8c7a4bb4a85c3027f0ff9a46026a9117e84fe54a2",
    "input_hash_source": "tasks/R2-LOAD-0004.json (구현이 착수 근거로 삼은 READY Task Contract)",
    "source_transparency_note": "이 산출물은 Claude Code 콘솔에서 claude_agent 공급자로 생성되었다. model 값은 이 세션이 보고한 실제 모델 식별자 claude-opus-5[1m]이며 대괄호 접미사는 1M 컨텍스트 변형을 뜻한다.",
    "provider_id": "claude_agent",
    "code_generation_provider": "claude_agent",
    "provider_substitution_occurred": false,

    "component_count": 6,
    "component_list": "games/roulette/load-observation-contract.yaml, scripts/observe_r2_load.py, tests/test_load_observation.py, docs/games/R2-load-observation.md, docs/approvals/R2-LOAD-0004-validation-report.md, audit/events/R2-LOAD-0004-events.json",
    "component_hash_form": "canonical LF (studio_core.integrity.hash_file)",
    "component_hash_load_observation_contract_yaml": "sha256:4e9a4f515c46eab28245a4d205a890f8a35847fb4ec3e6d5436953be3e425fc2",
    "component_hash_observe_r2_load_py": "sha256:2fd6bdf84a677757f31fd849ac6a10bdca6b22f6a0e9e9526b7e506016f443b6",
    "component_hash_test_load_observation_py": "sha256:8008856d31ebeb167159d598d80dad8c3804a22ab4afd225ab9bac9d96ea259d",
    "component_hash_R2_load_observation_md": "sha256:0a578647c73554ddd7becd722eef184263b2244fdf2148ea8323f3b502cef8dc",
    "component_hash_R2_LOAD_0004_validation_report_md": "sha256:51bf32c83a6b559b11a43f7806bebe701cadd81548ee66f98388caf9a87d19ef",
    "component_hash_R2_LOAD_0004_events_json": "sha256:4f31a4d353a21ed5f55cc06d4cfd2cb85edd216de2f320c6fd5fcb52a2a86293",

    "files_created_by_this_unit": 9,
    "files_created_list": "games/roulette/load-observation-contract.yaml, scripts/observe_r2_load.py, tests/test_load_observation.py, docs/games/R2-load-observation.md, docs/approvals/R2-LOAD-0004-validation-report.md, audit/events/R2-LOAD-0004-events.json, tasks/R2-LOAD-0004.json, artifacts/R2-LOAD-0004-artifact.json, handoffs/R2-LOAD-0004-handoff.json",
    "existing_files_modified": 0,
    "existing_files_modified_scope_note": "이 유닛이 만들지 않은 기존 저장소 파일은 하나도 수정되지 않았다. 이 제출 단계에서 쓴 파일은 artifacts/R2-LOAD-0004-artifact.json과 handoffs/R2-LOAD-0004-handoff.json 두 건뿐이다.",
    "validate_baseline_modified": false,
    "production_code_written": false,
    "test_code_written": true,
    "tool_code_written": true,
    "implementation_completed": true,
    "new_http_routes": 0,
    "new_runtime_modules": 0,
    "runtime_instrumentation_added_to_observed_code": false,
    "server_api_changed": false,
    "route_count_unchanged": 4,

    "stdlib_only": true,
    "new_external_dependencies": 0,
    "package_installation_performed": false,
    "build_step_added": false,
    "target_binding": "loopback only",
    "external_or_production_load": false,
    "remote_host_resolution_attempted": false,

    "bounded_execution_max_concurrency": 16,
    "bounded_execution_max_total_requests": 128,
    "bounded_execution_max_rounds": 32,
    "bounded_execution_max_wall_seconds": 60,
    "bounded_execution_bounds_are_safety_limits_not_slo": true,
    "bounded_execution_bounds_compared_against_observed_values": false,
    "implementation_default_concurrency": 4,
    "implementation_default_rounds": 3,
    "implementation_default_warmup_requests": 2,
    "implementation_default_wall_seconds": 30,
    "implementation_defaults_are_lower_than_maxima": true,
    "implementation_defaults_may_exceed_maxima": false,
    "bound_refusal_is_enforced_before_any_resource_is_created": true,
    "request_plan_formula": "warmup_requests + rounds * (2 * concurrency + 1)",

    "measurement_is_observation_only": true,
    "observed_metrics_asserted_by_tests": false,
    "slo_declared": false,
    "latency_thresholds_declared": false,
    "throughput_targets_declared": false,
    "capacity_promise_made": false,
    "schedule_established": false,
    "r5_schedule_established": false,
    "infrastructure_procurement": false,
    "penetration_testing": false,
    "multi_user_identity_or_session_feature": false,
    "observed_metrics_recorded": "latency_ms.min, latency_ms.median, latency_ms.p95, latency_ms.max, throughput.requests_per_second, throughput.rounds_per_second, serialization_wait_proxy_ms.min, serialization_wait_proxy_ms.median, serialization_wait_proxy_ms.p95, serialization_wait_proxy_ms.max",
    "asserted_properties_count": 10,
    "asserted_properties_list": "single_authoritative_draw_per_round, single_settlement_per_round, balance_delta_matches_ledger, currency_is_integer_only, duplicate_request_id_commits_once, duplicate_callers_observe_same_commit, audit_refs_globally_unique, audit_events_match_committed_rounds, audit_chain_verified_after_reload, bounded_execution",
    "serialization_wait_metric_name": "serialization_wait_proxy_ms",
    "serialization_wait_is_proxy_only": true,
    "serialization_wait_measures_internal_lock_acquisition": false,
    "serialization_wait_proxy_combines_scheduler_and_serialized_service_effects": true,
    "production_instrumentation_permitted": false,

    "windows_sqlite_handle_leak_found_after_focused_tests_passed": true,
    "windows_sqlite_handle_leak_reworked": true,
    "leak_rework_summary": "sqlite3 연결은 그것을 연 스레드에 묶이고 ThreadingHTTPServer는 요청마다 별도 작업자 스레드를 쓴다. 주 스레드의 store.close()는 다른 스레드의 연결을 닫지 못하고, 슬라이스가 daemon_threads를 쓰므로 socketserver는 작업자를 조인하지 않는다. Windows에서 열린 핸들은 파일 잠금이므로 임시 작업 공간 삭제가 실패했다. 재작업은 작업자 스레드 자신이 handle()의 finally에서 DurableRoundStore.release_thread_connection()을 호출하고, 하네스가 작업자 목록을 등재해 유계 조인하며, 요청마다 새 연결과 Connection: close를 쓰고, ignore_cleanup_errors를 제거해 삭제 실패를 WORKSPACE_NOT_RELEASED로 드러내는 방식이다.",
    "leak_rework_used_only_existing_public_api": true,
    "leak_rework_modified_frozen_runtime_files": false,
    "all_thread_joins_bounded": true,
    "cleanup_errors_suppressed": false,

    "stale_pre_fix_temporary_workspaces": 20,
    "stale_workspace_prefix": "ts-studio-r2-load-",
    "stale_workspaces_inside_repository": false,
    "stale_workspaces_created_by_pre_fix_defect": true,
    "stale_workspaces_removed_in_this_unit": false,
    "stale_workspaces_pending_explicit_cleanup": true,
    "stale_workspace_contents_note": "저장소 밖 운영체제 임시 디렉터리 아래에 있으며 로컬 SQLite 관측 잔여물만 들어 있다. 비밀값과 개인정보는 없다. 절대 경로는 이 아티팩트에 기록하지 않는다.",

    "frozen_paths_pinned": 17,
    "frozen_paths_modified": 0,
    "inputs_pinned_total": 29,
    "inputs_hashes_verified_against_working_tree": true,
    "validate_baseline_pinned_as_input": false,
    "repin_of_other_contracts": 0,
    "r4_art_0007_touched": false,
    "r4_deliverables_touched": false,
    "asset_or_image_paths_touched": false,
    "art_created_by_claude": false,
    "art_reviewed_by_claude": false,

    "data_classification": "INTERNAL",
    "contains_pii": false,
    "workspace_access": "TASK_WRITE",
    "network_policy": "NONE",
    "secrets_policy": "NONE",
    "budget_finite": true,
    "budget_stop_on_limit": true,
    "secrets_recorded": false,
    "hostname_recorded": false,
    "username_recorded": false,
    "absolute_temp_path_recorded": false,
    "entropy_material_recorded": false,

    "self_verification_completed": true,
    "validation_commands_executed": true,
    "baseline_validator_result": "PASS",
    "full_test_suite_result": "PASS",
    "full_test_suite_tests_run": 706,
    "full_test_suite_skipped": 4,
    "full_test_suite_failures": 0,
    "focused_test_suite_result": "PASS",
    "focused_test_suite_tests_run": 98,
    "compileall_result": "PASS",
    "secret_scan_result": "PASS",
    "secret_scan_files_scanned": 207,
    "secret_scan_findings": 0,
    "observed_run_times_are_not_thresholds": true,
    "internal_code_review_completed": false,
    "independent_review_completed": false,
    "a20_independent_code_review": "NOT_RUN",
    "a50_qa_gate_decision": "NOT_RUN",
    "user_final_approval": "NOT_RUN",
    "human_approved": false,
    "approver_signatures_collected": false,
    "hosted_ci_observed": false,
    "hosted_ci_status": "NOT_RUN",
    "production_ready": false,
    "production_readiness_status": "PENDING",
    "committed": false,
    "pushed": false,
    "merged": false,
    "commit_push_merge_status": "NOT_RUN",
    "lifecycle_note": "이 아티팩트는 구현 제출이다. 자체 점검은 완료했고 A-20 독립 코드 검토, A-50·USER 최종 게이트, 호스티드 CI 관측, 운영 준비 판정, 커밋·푸시·병합은 하나도 수행되지 않았다. 이 문서를 최종 승인 증거로 읽어서는 안 된다.",
    "successor_status_requires": "A-20 독립 코드 검토, 두 표준 검증 명령의 독립 재실행, A-50·USER 최종 게이트, 그리고 저장소 밖 임시 작업 공간 20건의 명시적 정리"
  },
  "reviewers": [
    "A-20",
    "A-50"
  ],
  "created_at": "2026-09-02T00:00:00Z",
  "approved_at": null
}
