{
  "schema_version": "1.0.0",
  "artifact_id": "ART-SYS-CLD-0011-0001",
  "task_id": "SYS-CLD-0011",
  "project_id": "casino-core",
  "artifact_type": "DOCUMENT",
  "name": "codex-claude-collaboration-protocol",
  "uri": "repo://operations/collaboration.yaml",
  "version": "1.0.0",
  "content_hash": "sha256:03031cf600fe847737d535c364f183b6f0031464fc3a8fdd076b79826506733a",
  "status": "SUBMITTED",
  "source": {
    "kind": "AI_GENERATED",
    "created_by": "A-02",
    "provider": "claude_agent",
    "model": "claude-opus-5",
    "input_hash": "sha256:53efd0990848459acda2db0b2b306539d6577cd0fe1cfe45beb538056c9a9e0e"
  },
  "rights": {
    "license": "TS-STUDIO-INTERNAL",
    "commercial_use": true,
    "training_permission": "NOT_APPLICABLE",
    "provenance_complete": true
  },
  "specification": {
    "protocol_id": "COLLAB-CODEX-CLAUDE-001",
    "format": "yaml",
    "guide": "docs/operations/SYS-CLD-0011-codex-claude-collaboration.md",
    "gate_implementation": "studio_core/collaboration.py",
    "validator": "scripts/validate_baseline.py::validate_collaboration",
    "negative_tests": "tests/test_collaboration.py",
    "connection_proof": "providers/evidence/SYS-CLD-0011-claude-connection-proof.yaml",
    "generator_verifier_separated": true,
    "credential_storage": "os_credential_manager",
    "secrets_recorded": false,
    "committed": false
  },
  "reviewers": ["A-20", "A-50"],
  "created_at": "2026-09-01T00:00:00Z",
  "approved_at": null
}
