{
  "schema_version": "1.0.0",
  "artifact_id": "ART-R4-ART-0007-0001",
  "task_id": "R4-ART-0007",
  "project_id": "casino-core",
  "artifact_type": "IMAGE",
  "name": "r4-art-table-atmosphere-background",
  "uri": "repo://assets/roulette/table-atmosphere-background.webp",
  "version": "1.0.0",
  "content_hash": "sha256:e1211d1e3418b5fc77b454227ac2a9c93ea6df27a19f56123973e5246347ef27",
  "status": "SUBMITTED",
  "source": {
    "kind": "AI_GENERATED",
    "created_by": "A-02",
    "provider": "codex_imagegen",
    "model": null,
    "input_hash": "sha256:ffa8d7688fea7e75dd54160d95a30f1c2bfea2a69f45f1971bc964316f4e43a5"
  },
  "rights": {
    "license": "PENDING-HUMAN-DETERMINATION",
    "commercial_use": false,
    "training_permission": "UNKNOWN",
    "provenance_complete": false
  },
  "specification": {
    "asset_status": "CANDIDATE",
    "final_asset_designation": false,
    "deliverable_name": "r4-art-table-atmosphere-background",
    "background_path": "assets/roulette/table-atmosphere-background.webp",
    "background_hash": "sha256:e1211d1e3418b5fc77b454227ac2a9c93ea6df27a19f56123973e5246347ef27",
    "background_bytes": 27024,
    "background_format": "WEBP",
    "background_width_px": 2560,
    "background_height_px": 1440,
    "background_alpha_channel": false,
    "background_frame_count": 1,
    "background_source_render_hash": "sha256:ffa8d7688fea7e75dd54160d95a30f1c2bfea2a69f45f1971bc964316f4e43a5",
    "background_source_render_retained_in_repository": false,
    "felt_tile_path": "assets/roulette/felt-tile.png",
    "felt_tile_hash": "sha256:59208eb18461045d27b86d574d0cbe48fbbd0603a279dda48c02cb73b15b9dc7",
    "felt_tile_bytes": 79412,
    "felt_tile_format": "PNG-24",
    "felt_tile_width_px": 512,
    "felt_tile_height_px": 512,
    "felt_tile_alpha_channel": false,
    "felt_tile_frame_count": 1,
    "felt_tile_source_render_hash": "sha256:f2c69e40619ff288b85c3b4ccce5aa0b227886ae396da3e70ad53655a6797bbd",
    "manifest_path": "assets/manifests/R4-ART-0007-assets.json",
    "manifest_hash": "sha256:08c5156e9ac849cf599233e57dfdda77d1d257720e8dd63a9cbad07a97a2faf1",
    "manifest_bytes": 2036,
    "generation_record_path": "docs/art/R4-ART-0007-generation-record.json",
    "generation_record_hash": "sha256:9c2f6aa5260886cccd3a6b93a0b251bd370725f089116e53107911d124cce780",
    "generation_record_bytes": 13746,
    "art_direction_brief_path": "docs/art/R4-ART-0007-art-direction.md",
    "art_direction_brief_hash": "sha256:344df66159d0fac9795bc78bb6a06951c2085687735c994c6f2fec3561ee0ea3",
    "art_direction_brief_bytes": 14681,
    "total_binary_bytes": 106436,
    "hash_canonicalisation": "studio_core.integrity canonical form; both bitmaps classify as binary and are hashed over raw bytes per .gitattributes (*.webp binary, *.png binary)",
    "manifest_hash_verification_result": "PASS",
    "objective_metrics_result": "PASS",
    "objective_ac001_header_geometry_result": "PASS",
    "objective_ac002_central_to_gutter_edge_ratio": 0.142016618,
    "objective_ac003_max_relative_luminance": 0.236868665,
    "objective_ac003_mean_relative_luminance": 0.00439271,
    "objective_ac004_seam_ratio": 0.0,
    "objective_ac004_low_frequency_variation_percent": 0.757519,
    "objective_ac005_max_local_luma_std_16px": 1.9678,
    "objective_ac006_estimated_gold_area_percent": 0.360867,
    "objective_ac006_estimated_red_area_percent": 0.031603,
    "objective_ac008_binary_budget_result": "PASS",
    "objective_metrics_scope": "programmatic pixel statistics and file-header reads only; they do not substitute for any human visual determination",
    "provider_id": "codex_imagegen",
    "provider_route": "image",
    "provider_invocation_path": "managed connector",
    "model_name": "unavailable",
    "model_version": "unavailable",
    "model_value_recorded_as": "null; managed built-in path does not expose a model name or version and none was invented",
    "per_call_cost_usd": "unavailable",
    "external_reference_material_used": false,
    "derived_from_prior_probe_images": false,
    "prompts_recorded_verbatim": true,
    "mechanical_processing_only": true,
    "rights_determination_status": "PENDING",
    "training_permission_status": "PENDING",
    "commercial_use_status": "PENDING",
    "rights_determination_owner": "A-30",
    "provenance_complete": false,
    "human_visual_qa_of_processed_files": "PENDING",
    "source_image_observation_scope": "the provider's source renders were displayed at generation time and no prohibited content was observed by Codex at that point; this is a limited source observation, not visual QA of the final processed files",
    "final_processed_image_view_blocked": true,
    "final_processed_image_view_block_reason": "the Windows view-image sandbox failed, so the processed WebP and PNG were never re-displayed for inspection",
    "ac010_prohibited_content_determination": "PENDING",
    "ac011_tone_determination": "PENDING",
    "ac007_contrast_composite_verification": "PENDING",
    "accessibility_and_render_integration_check": "PENDING",
    "a30_art_direction_approval": "PENDING",
    "a50_independent_review": "PENDING",
    "user_art_direction_signoff": "PENDING",
    "final_gate_decision": "NOT_ISSUED",
    "code_integration_performed": false,
    "static_suffix_allowlist_amended": false,
    "assets_currently_servable": false,
    "static_suffix_gap": "ALLOWED_STATIC_SUFFIXES in apps/roulette_web/server.py contains neither .webp nor .png, so both assets return 404 today; the amendment is owned by a follow-up integration unit",
    "app_tests_scripts_task_images_manifest_brief_modified": false,
    "committed": false,
    "pushed": false,
    "hosted_ci_run_observed": false,
    "production_ready": false,
    "integration_ready": false,
    "validate_baseline_result_current_tree": "PASS on the isolated LF-normalised canonical copy; python scripts/validate_baseline.py exit code 0 as observed by Codex",
    "full_suite_result_canonical_lf_copy": "PASS; python -m unittest discover -s tests -v reported Ran 579 tests, OK, 6 skipped, exit code 0 as observed by Codex on the isolated LF copy",
    "full_suite_result_windows_crlf_worktree": "RUN AND OBSERVED ON THIS PHYSICAL WINDOWS CHECKOUT: python -m unittest discover -s tests -v reported Ran 579 tests, FAILED (failures=1), 4 skipped. The sole failure is tests.test_roulette_web_ui.StaticDeliveryTests.test_the_served_index_is_the_file_on_disk_and_links_only_local_assets, caused by the known CRLF raw-byte versus read_text LF-normalisation mismatch in a Windows core.autocrlf physical checkout. It is pre-existing, unrelated to the R4-ART-0007 assets, touches no file this task modified, and does not reproduce on the LF-normalised canonical form, where the same command reported Ran 579 tests, OK, 6 skipped, exit code 0.",
    "completion_gate_blocked": false,
    "completion_gate_block_reason": "the machine completion commands passed on the isolated LF-normalised copy (validate_baseline exit 0; full suite Ran 579, OK, 6 skipped, exit 0), so standard validation no longer blocks; final art designation remains blocked by the human visual QA, rights, A-30 art-direction, A-50 independent review and USER approvals, and a GitHub hosted CI run on the canonical form is still required",
    "repository_binary_file_count": 2,
    "tests_weakened_or_assets_removed_to_pass": false,
    "hosted_ci_still_required": true,
    "rollback_requires_commit_revert": false
  },
  "reviewers": ["A-30", "A-50"],
  "created_at": "2026-09-02T00:00:00Z",
  "approved_at": null
}
