{
  "schema_version": "1.0.0",
  "artifact_id": "ART-R2-RNG-0001-0001",
  "task_id": "R2-RNG-0001",
  "project_id": "casino-core",
  "artifact_type": "CODE",
  "name": "r2-rng-production-csprng",
  "uri": "repo://studio_core/rng.py",
  "version": "1.0.0",
  "content_hash": "sha256:0ceea3c08a4c526a1d203f54fcbb31b35fff088450477f95270526d9f38e1d1e",
  "status": "SUBMITTED",
  "source": {
    "kind": "AI_GENERATED",
    "created_by": "A-20",
    "provider": "claude_agent",
    "model": "claude-opus-5",
    "input_hash": "sha256:9d8ea76aef04c25d182fc2f25f3c3e0e988aa3e997b82cc918ad3ee86004114b"
  },
  "rights": {
    "license": "TS-STUDIO-INTERNAL",
    "commercial_use": true,
    "training_permission": "NOT_APPLICABLE",
    "provenance_complete": true
  },
  "specification": {
    "algorithm_id": "CSPRNG-REJECTION-UNIFORM-37",
    "algorithm_version": "1.0.0",
    "ruleset_id": "ROULETTE-EU-SINGLE-ZERO-1",
    "entropy_source": "os_csprng",
    "unbiased_mapping": "rejection_sampling",
    "accepted_byte_limit": 222,
    "pockets": 37,
    "record_schema": "games/roulette/rng-draw-record.schema.json",
    "statistics_module": "studio_core/rng_stats.py",
    "validator": "scripts/validate_baseline.py::validate_r2_rng",
    "tests": "tests/test_rng.py",
    "recovered_from_gate_violation": true,
    "recovery_record": "docs/operations/R2-RNG-0001-recovery.md",
    "recovered_draft_hash": "sha256:aedfacb41a18e03756f21ddd3203df9f9b82abf4c73d1319b838bf44c78d8591",
    "proof_verification": "verify_draw_record",
    "denial_audit": true,
    "draw_serialized_by_lock": true,
    "statistics_module_hash": "sha256:ce4f06bfe3387992b3f88135fb16798a9b365298974febfc672519c10218dfdf",
    "record_schema_hash": "sha256:4cde6ce3e3ff47715badb7f90166aec1720c4f3e3ff6a69a71ef7ea67d8dda5b",
    "independent_review": "code-reviewer, 12 findings, all addressed",
    "durable_state": false,
    "secrets_recorded": false,
    "committed": false,
    "lifecycle_note": "SUBMITTED: implemented under a READY Task Contract after gate-violation recovery; independently reviewed and re-verified. Final QA gate remains with A-50/USER."
  },
  "reviewers": ["A-50", "A-02"],
  "created_at": "2026-09-01T00:00:00Z",
  "approved_at": null
}
