{
  "schema_version": "1.0.0",
  "artifact_id": "ART-R2-NET-0003-0001",
  "task_id": "R2-NET-0003",
  "project_id": "casino-core",
  "artifact_type": "CODE",
  "name": "r2-net-reconnect-continuity",
  "uri": "repo://apps/roulette_web/static/app.js",
  "version": "1.3.0",
  "content_hash": "sha256:e312cbf0c10a9e2be373d617a2fcfa3c24621f465e32d95199f001cb9d6e0487",
  "status": "SUBMITTED",
  "source": {
    "kind": "AI_GENERATED",
    "created_by": "A-02",
    "provider": "claude_agent",
    "model": "claude-opus-5",
    "input_hash": "sha256:209f9ad3bea33e4cc7332a01065258e2aa0345484fcaf9bbcc02df22157fd9b3"
  },
  "rights": {
    "license": "TS-STUDIO-INTERNAL",
    "commercial_use": true,
    "training_permission": "NOT_APPLICABLE",
    "provenance_complete": true
  },
  "specification": {
    "artifact_role": "R2-NET-0003 재접속·라운드 연속성 구현 아티팩트",
    "artifact_scope": "등록 대상은 클라이언트 재접속 동작을 담은 apps/roulette_web/static/app.js이며, 아래 해시로 재접속 계약, 시험 스위트, 검증기, 설계 문서를 함께 고정한다. 이 유닛은 새 HTTP 경로도 새 런타임 모듈도 만들지 않으므로 서버 측 신규 산출물이 없다.",
    "represents": "apps/roulette_web/static/app.js",
    "represents_implementation": true,
    "phase": "PHASE_B_IMPLEMENTATION_SUBMITTED",
    "task_status_at_submission": "READY",
    "risk_class": "HIGH",
    "contract_hash": "sha256:777fbae659ce418f4c7428233edce454437d2e00f1ba647b841bda8384881475",
    "test_suite_hash": "sha256:b2366ce46e7193384f5da0f1e6184c68cfc7840f4299a38e61803d219ed926bc",
    "validator_hash": "sha256:6afefe21674a509a6ed7ffc5695e388e4ff14e1af4a2590da4741c24fd10f45c",
    "design_document_hash": "sha256:792102e58c68f827e156835a78ed73d7fa8765c2b4804346a67b45814a2f9e39",
    "task_contract_hash": "sha256:209f9ad3bea33e4cc7332a01065258e2aa0345484fcaf9bbcc02df22157fd9b3",
    "content_hash_form": "canonical LF (studio_core.integrity.hash_file)",
    "implementation_completed": true,
    "tests_run": true,
    "reconnect_tests_count": 29,
    "reconnect_tests_repeated_runs": 3,
    "validation_commands_executed": true,
    "independent_review_completed": false,
    "human_approved": false,
    "approver_signatures_collected": false,
    "hosted_ci_observed": false,
    "production_ready": false,
    "r5_schedule_established": false,
    "rehydration_path": "GET /api/state",
    "response_loss_recovery_path": "POST /api/spin retry with the same request_id",
    "new_http_routes": 0,
    "new_runtime_modules": 0,
    "server_api_changed": false,
    "server_constructor_changed": false,
    "validator_stage": "scripts/validate_baseline.py::validate_r2_reconnect",
    "validator_negative_tests": 12,
    "second_draw_observed": false,
    "second_entropy_consumption_observed": false,
    "second_ledger_settlement_observed": false,
    "balance_moved_on_retry": false,
    "open_round_bets_restored": false,
    "per_bet_outcomes_recoverable_after_restart": false,
    "ac_003_safety_properties_met": true,
    "contract_wording_amended_by_implementer": false,
    "frozen_paths_verified": 9,
    "frozen_paths_modified": 0,
    "repin_contracts": "tasks/SYS-AST-0014.json, tasks/SYS-CI-0012.json, tasks/SYS-QA-0015.json, artifacts/R4-UI-0006-artifact.json",
    "repin_field": "AC-010 열거: SYS-AST-0014/SYS-CI-0012/SYS-QA-0015의 inputs[repo://scripts/validate_baseline.py].content_hash, SYS-QA-0015의 inputs[repo://artifacts/R4-UI-0006-artifact.json].content_hash, artifacts/R4-UI-0006-artifact.json의 component_hash:apps/roulette_web/static/app.js",
    "self_repin_note": "tasks/R2-NET-0003.json이 docs/operations/R2-followup-units.md를 입력이자 산출물로 선언하므로 그 문서를 갱신하면서 자기 입력 해시도 갱신했다. 계약 자신의 입력 해시이므로 AC-010이 열거한 외부 메타데이터 폐포와는 구분해 기록한다.",
    "r4_art_0007_touched": false,
    "asset_or_image_paths_touched": false,
    "rules_changed": false,
    "payout_schedule_changed": false,
    "rng_algorithm_changed": false,
    "ledger_semantics_changed": false,
    "first_implementation_attempt": "INTERRUPTED_AND_DISCARDED",
    "first_attempt_undeclared_file_modified": "games/roulette/playable-slice-contract.yaml",
    "first_attempt_reached_validation": false,
    "first_attempt_reached_commit": false,
    "first_attempt_diff_preserved_outside_repository": true,
    "restoration_base_commit": "454468b",
    "restoration_verified_by_hash": true,
    "destructive_git_commands_used": false,
    "secrets_recorded": false,
    "contains_pii": false,
    "committed": false,
    "pushed": false,
    "lifecycle_note": "SUBMITTED: 구현과 자체 점검이 끝났고 두 표준 검증 명령이 로컬에서 통과했다. AC-003과 AC-010은 관측된 사실에 맞춰 승인 아래 명확화되었으므로 미해결 수용 기준 편차는 없다. 1차 시도 중단과 2차 무결성 연쇄 중단이라는 역사적 사실은 그대로 보존한다. 독립 검증, A-20 코드 검토, A-50·USER 최종 QA 게이트, 호스티드 CI는 하나도 수행되지 않았으므로 REVIEWED 이상으로 승격할 수 없다.",
    "successor_status_requires": "Codex 독립 검증, 읽기 전용 코드 검토, A-50·USER 최종 게이트, 호스티드 CI 관측",
    "baseline_validator_result": "PASS",
    "scope_widened_without_authorization": false,
    "undeclared_cascade_found_during_implementation": "artifacts/R4-UI-0006-artifact.json이 specification의 component_hash 키로 apps/roulette_web/static/app.js를 고정하고 있었다. 최초 역방향 추적이 inputs와 artifact.uri만 보고 이 키를 보지 않은 것이 원인이다.",
    "undeclared_cascade_action": "구현자는 임의로 고치지 않고 중단해 보고했다. Codex의 REWORK 승인 이후에만 두 줄을 수정했다.",
    "authorized_second_repin": "artifacts/R4-UI-0006-artifact.json의 component_hash:apps/roulette_web/static/app.js 한 줄, tasks/SYS-QA-0015.json의 inputs[repo://artifacts/R4-UI-0006-artifact.json].content_hash 한 줄",
    "closure_recomputed_including_component_hash": true,
    "closure_terminal": true,
    "closure_reaches_r4_art_0007": false,
    "deliverables_count": 14,
    "ac_003_amended_by_approval": "재시작 경로에서 도달하지 않는 REQUEST_ID_ALREADY_USED 요구를 제거하고, 시험이 실제로 관측한 NO_BETS(빈 새 라운드)와 DRAW_DENIED(요청 지문 충돌)를 기술하도록 Codex 승인 아래 개정했다. 안전 속성 문언은 그대로다.",
    "ac_010_amended_by_approval": "재고정 범위를 계약 3건에서 승인된 네 파일 메타데이터 폐포로 개정했다. SYS-AST-0014 검증기 해시, SYS-CI-0012 검증기 해시, SYS-QA-0015 검증기 해시와 R4 UI 아티팩트 입력 해시, R4 UI 아티팩트의 app.js component_hash. 전부 해시 값만 변경 가능하다.",
    "unresolved_acceptance_criterion_deviations": 0,
    "criteria_amended_by_implementer_without_authorization": false,
    "contract_clarifications_authorized_by": "Codex contract-alignment authorization",
    "metadata_closure_files": 4,
    "metadata_closure_hash_values_only": true,
    "metadata_closure_terminal": true,
    "audit_events_count": 7
  },
  "reviewers": [
    "A-20",
    "A-50"
  ],
  "created_at": "2026-09-02T00:00:00Z",
  "approved_at": null
}
