{
  "schema_version": "1.0.0",
  "artifact_id": "ART-SYS-IMG-0013-0001",
  "task_id": "SYS-IMG-0013",
  "project_id": "casino-core",
  "artifact_type": "DOCUMENT",
  "name": "codex-imagegen-art-provider-registration",
  "uri": "repo://docs/providers/SYS-IMG-0013-codex-imagegen-art-provider.md",
  "version": "1.0.0",
  "content_hash": "sha256:c214438ac1b03d24ae3003afa646527eaa1ddd75ee8cb2786725880a23a79b3b",
  "status": "SUBMITTED",
  "source": {
    "kind": "AI_GENERATED",
    "created_by": "A-02",
    "provider": "claude_agent",
    "model": null,
    "input_hash": "sha256:8f8134146cf00581de4c657689c715bd7134eae4f283e6c7762cd6892448eda4"
  },
  "rights": {
    "license": "TS-STUDIO-INTERNAL",
    "commercial_use": true,
    "training_permission": "NOT_APPLICABLE",
    "provenance_complete": true
  },
  "specification": {
    "provider_id": "codex_imagegen",
    "display_name": "Codex Built-in ImageGen",
    "capabilities": "image",
    "capability_count": 1,
    "code_capability_granted": false,
    "reasoning_capability_granted": false,
    "evaluation_capability_granted": false,
    "orchestration_capability_granted": false,
    "provider_status": "ENABLED",
    "registry_entry": "providers/registry.yaml#providers[provider_id=codex_imagegen]",
    "registry_hash": "sha256:f6bc6f8826fe83586c5a52a8e99949d5350ec76c5d4abf35fdd3288cd1c3f98a",
    "image_route_before": "preferred: layer_ai, fallbacks: []",
    "image_route_after": "preferred: codex_imagegen, fallbacks: []",
    "routing_policy": "providers/routing-policy.yaml",
    "routing_policy_hash": "sha256:f970a037540ad2cfd1496a919e32cf4cbd9c5bb37a899b79b98ee6f24c6b3b2b",
    "code_route_unchanged": "preferred: claude_agent, fallbacks: []",
    "reasoning_route_unchanged": "preferred: claude_agent, fallbacks: []",
    "evaluation_route_unchanged": "preferred: claude_agent, fallbacks: []",
    "claude_agent_entry_modified": false,
    "codex_primary_status": "DISABLED",
    "codex_primary_disabled_reason_preserved": true,
    "codex_activated_as_code_provider": false,
    "adr_0003_boundary_changed": false,
    "layer_ai_status": "DISABLED_UNTIL_CONFIGURED",
    "layer_ai_in_any_route": false,
    "layer_ai_future_option": "usage 증가 시 사용자와 A-00이 별도 결정하는 후속 옵션으로만 문서화",
    "layer_ai_usage_threshold_defined": false,
    "layer_ai_schedule_defined": false,
    "connection_proof": "providers/evidence/SYS-IMG-0013-codex-imagegen-connection-proof.yaml",
    "connection_proof_hash": "sha256:fdf1ce3806177cdf9e87f299bc2fafb0d74359efc0b4f206bb13520ed5485b2e",
    "connection_proof_id": "PROOF-SYS-IMG-0013-001",
    "connection_proof_overall_result": "PASS",
    "probe_count": 5,
    "blocking_probe_count": 4,
    "blocking_probes_all_pass": true,
    "proof_recorded_by": "A-02",
    "proof_verified_by": "A-20",
    "proof_recorder_verifier_separated": true,
    "activation_gated_on_proof": true,
    "status_without_proof": "DISABLED_UNTIL_CONFIGURED",
    "credential_ref": "secret-ref://providers/codex-imagegen",
    "credential_source": "PROVIDER_NATIVE_AUTH_STORE",
    "managed_credential_storage": "managed_workspace_auth",
    "secret_values_recorded": false,
    "plaintext_secret_scan": "PASS",
    "data_classification": "INTERNAL",
    "allowed_data_classifications": "PUBLIC, INTERNAL",
    "user_authorization_granted": true,
    "model_name": "unavailable",
    "model_version": "unavailable",
    "model_value_recorded_as": "null (environment.model), 임의 모델명·버전 생성 금지",
    "per_call_cost_usd": "unavailable",
    "cost_disclosure_by_managed_path": false,
    "budget_stop_on_limit": true,
    "budget_max_cost_usd": 10.0,
    "pre_registration_images_promoted": false,
    "pre_registration_image_status": "연결 확인용 프로브 또는 후보 자산에 한정하며 프로덕션 승인 증거로 승격하지 않음",
    "pre_registration_images_stored_in_repo": false,
    "audit_events": "audit/events/SYS-IMG-0013-events.json",
    "audit_events_hash": "sha256:7df2986322b1b7241a4e0aa3e9f8bb9003b99bfd56bf939320b55c012f3afe71",
    "audit_contains_secret": false,
    "gate_tests": "tests/test_image_provider.py",
    "gate_tests_hash": "sha256:f5b38fd3785faa3a087a1e1284cbd1e2185099669656f39b577a7e7a48c8a261",
    "provider_guide": "docs/providers/SYS-IMG-0013-codex-imagegen-art-provider.md",
    "focused_tests_result": "PASS",
    "integrity_hash_check_result": "PASS",
    "full_suite_result_canonical_lf": "PASS (467 tests, skipped=1)",
    "full_suite_result_windows_crlf_worktree": "1 pre-existing unrelated failure (test_roulette_web_ui static index CRLF byte compare, R4-UI-0006)",
    "existing_files_modified_by_this_contract_pair": false,
    "human_approval_recorded": false,
    "committed": false,
    "pushed": false,
    "hosted_ci_run_observed": false,
    "rollback_requires_commit_revert": false
  },
  "reviewers": ["A-20", "A-50"],
  "created_at": "2026-09-02T00:00:00Z",
  "approved_at": null
}
