{
  "schema_version": "1.0.0",
  "artifact_id": "ART-ROULETTE-RULES-0001",
  "task_id": "CASINO-RULE-0001",
  "project_id": "casino-core",
  "artifact_type": "DOCUMENT",
  "name": "roulette-ruleset",
  "uri": "docs://games/roulette/ruleset-v1",
  "version": "1.0.0",
  "content_hash": "sha256:2222222222222222222222222222222222222222222222222222222222222222",
  "status": "SUBMITTED",
  "source": {
    "kind": "AI_ASSISTED",
    "created_by": "A-10",
    "provider": "provider-gateway",
    "model": "approved-reasoning-model",
    "input_hash": "sha256:1111111111111111111111111111111111111111111111111111111111111111"
  },
  "rights": {
    "license": "TS-STUDIO-INTERNAL",
    "commercial_use": true,
    "training_permission": "NOT_APPLICABLE",
    "provenance_complete": true
  },
  "specification": {
    "format": "markdown",
    "ruleset_version": "1.0.0",
    "deterministic": true
  },
  "reviewers": ["A-50", "A-02"],
  "created_at": "2026-08-28T01:00:00Z",
  "approved_at": null
}

