{
  "schema_version": "1.0.0",
  "artifact_id": "ART-R2-DBC-0002-0001",
  "task_id": "R2-DBC-0002",
  "project_id": "casino-core",
  "artifact_type": "CODE",
  "name": "r2-dbc-durable-state-boundary",
  "uri": "repo://studio_core/durable_state.py",
  "version": "1.0.0",
  "content_hash": "sha256:5b24d3e265a5e3ac2f6b21adcdefb21356393089e905fe1df93cf583e56cb8ed",
  "status": "SUBMITTED",
  "source": {
    "kind": "AI_GENERATED",
    "created_by": "A-02",
    "provider": "claude_agent",
    "model": "claude-opus-5",
    "input_hash": "sha256:fc2bec02f86d0a84eacb7f5d753b45f5b2aa6e388b7d6105c445d3b0490abe6d"
  },
  "rights": {
    "license": "TS-STUDIO-INTERNAL",
    "commercial_use": true,
    "training_permission": "NOT_APPLICABLE",
    "provenance_complete": true
  },
  "specification": {
    "artifact_role": "R2-DBC-0002 내구 상태 경계 구현 아티팩트",
    "artifact_scope": "이 산출물은 추첨 기록·정산 원장·감사 이벤트를 하나의 트랜잭션으로 커밋하는 SQLite 참조 경계 구현이다. 등록 대상은 studio_core/durable_state.py이며 아래 해시로 계약·SQL 스키마·시험 스위트를 함께 고정한다.",
    "represents": "studio_core/durable_state.py",
    "represents_implementation": true,
    "contract_hash": "sha256:3920a1a87c46871353b936f56252d39dbd5542f628b7e2471c9e35a1d175fdd4",
    "sql_schema_hash": "sha256:ad4e90504e88ea2505aab097ace1cd7eacbc56a963cca642fee3dae65646f666",
    "test_hash": "sha256:8098db3095ec8791ace956d31006b87b7e482705e3fa3501c23ec7c4a7ca1bc0",
    "test_suite_hash": "sha256:8098db3095ec8791ace956d31006b87b7e482705e3fa3501c23ec7c4a7ca1bc0",
    "implementation_completed": true,
    "tests_run": true,
    "human_approved": false,
    "hosted_ci_observed": false,
    "independent_review_completed": false,
    "rng_module_modified": false,
    "phase": "PHASE_B_IMPLEMENTATION_SUBMITTED",
    "task_status_at_submission": "IN_PROGRESS",
    "risk_class": "HIGH",
    "engine": "sqlite3_stdlib",
    "external_database_server": "not_used",
    "isolation_level": "SERIALIZABLE",
    "transaction_mode": "IMMEDIATE",
    "journal_mode": "wal",
    "synchronous": "full",
    "foreign_keys_enforced": true,
    "busy_timeout_ms": 5000,
    "max_busy_retries": 5,
    "retry_backoff_seconds": 0.02,
    "storage_schema_version": 1,
    "audit_segment_size": 9999,
    "max_audit_segment": 99,
    "policy_version": "DURABLE-STATE-R2/1.0.0",
    "automatic_schema_upgrade": "denied",
    "automatic_schema_downgrade": "denied",
    "memory_database_allowed": false,
    "uri_filename_allowed": false,
    "integer_minimum_units_only": true,
    "idempotency_key_unique_constraint": true,
    "audit_events_append_only_at_database_level": true,
    "globally_unique_audit_reference": true,
    "concurrency_proved_by_real_threads": true,
    "contract_deliverable": "games/roulette/durable-state-contract.yaml",
    "sql_schema_deliverable": "games/roulette/durable-state-schema.sql",
    "test_deliverable": "tests/test_durable_state.py",
    "design_document": "docs/games/R2-durable-state.md",
    "validation_report": "docs/approvals/R2-DBC-0002-validation-report.md",
    "audit_events": "audit/events/R2-DBC-0002-events.json",
    "validator_stage": "scripts/validate_baseline.py::validate_r2_durable_state",
    "validation_command_baseline": "python scripts/validate_baseline.py",
    "validation_command_tests": "python -m unittest discover -s tests -v",
    "validation_commands_executed": true,
    "secrets_recorded": false,
    "committed": false,
    "pushed": false,
    "content_hash_form": "canonical LF (studio_core.integrity.hash_file)",
    "lifecycle_note": "SUBMITTED: 구현과 자체 점검은 끝났고 두 표준 검증 명령이 로컬에서 통과했다. 독립 코드 검토와 A-50·USER의 최종 QA 게이트는 아직 수행되지 않았으므로 REVIEWED 이상으로 승격할 수 없다. GitHub 호스티드 CI 결과는 원격 푸시 승인 전이라 관측되지 않았다.",
    "successor_status_requires": "독립 읽기 전용 코드 검토 완료, A-50·USER 최종 게이트 판정, 호스티드 CI 관측"
  },
  "reviewers": ["A-20", "A-50"],
  "created_at": "2026-09-01T00:00:00Z",
  "approved_at": null
}
